{
  "schema_version": "1.0",
  "candidate_commit": null,
  "trust_policy_sha256": "ce1c088d6dc3017ea6fceee212153b3d908f8c11a986fed5426ff7274c24d4c7",
  "overall_status": "BLOCKED",
  "gates": {
    "behavioral_qualification": {"status": "PENDING", "artifact_path": null, "artifact_sha256": null, "receipt_path": null, "receipt_sha256": null},
    "reviewer_attestation": {"status": "PENDING", "artifact_path": null, "artifact_sha256": null, "receipt_path": null, "receipt_sha256": null},
    "attempt_inventory": {"status": "PENDING", "artifact_path": null, "artifact_sha256": null, "receipt_path": null, "receipt_sha256": null},
    "holdout": {"status": "PENDING", "artifact_path": null, "artifact_sha256": null, "receipt_path": null, "receipt_sha256": null},
    "privacy_preflight": {"status": "PENDING", "artifact_path": null, "artifact_sha256": null, "receipt_path": null, "receipt_sha256": null},
    "bilingual_review": {"status": "PENDING", "artifact_path": null, "artifact_sha256": null, "receipt_path": null, "receipt_sha256": null},
    "pilot": {"status": "PENDING", "artifact_path": null, "artifact_sha256": null, "receipt_path": null, "receipt_sha256": null},
    "independent_release_review": {"status": "PENDING", "artifact_path": null, "artifact_sha256": null, "receipt_path": null, "receipt_sha256": null},
    "owner_promotion": {"status": "PENDING", "artifact_path": null, "artifact_sha256": null, "receipt_path": null, "receipt_sha256": null}
  },
  "index_sha256": "61af4dc78e5ddd1411eeee9801360fd6e1cb640996ed9a0fb1fb04a6cc2bbf73"
}
